{"$defs":{"absolutePath":{"pattern":"^/(?:[A-Za-z0-9._+-]+/)*[A-Za-z0-9._+-]+$","type":"string"},"digest":{"pattern":"^[0-9a-f]{64}$","type":"string"},"digestRef":{"additionalProperties":false,"properties":{"id":{"$ref":"#/$defs/id"},"sha256":{"$ref":"#/$defs/digest"}},"required":["id","sha256"],"type":"object"},"hex32":{"pattern":"^[0-9a-f]{32}$","type":"string"},"hex40":{"pattern":"^[0-9a-f]{40}$","type":"string"},"id":{"pattern":"^[a-z0-9][a-z0-9._-]{0,63}$","type":"string"},"licenseRef":{"additionalProperties":false,"properties":{"decision":{"enum":["affirmative","informational","restricted","user-supplied"]},"id":{"$ref":"#/$defs/id"},"text_sha256":{"$ref":"#/$defs/digest"}},"required":["id","text_sha256","decision"],"type":"object"},"path":{"not":{"pattern":"(?:^|/)(?:\\.|\\.\\.)(?:/|$)|//"},"pattern":"^[a-z0-9][a-z0-9._/-]{0,255}$","type":"string"},"positive":{"maximum":9223372036854775807,"minimum":1,"type":"integer"},"resourcePath":{"not":{"pattern":"(?:^|/)(?:\\.|\\.\\.)(?:/|$)|//"},"pattern":"^[A-Za-z0-9][A-Za-z0-9._/-]{0,255}$","type":"string"},"s64":{"maximum":9223372036854775807,"minimum":0,"type":"integer"},"systemRef":{"additionalProperties":false,"properties":{"id":{"$ref":"#/$defs/id"},"manifest_sha256":{"$ref":"#/$defs/digest"}},"required":["id","manifest_sha256"],"type":"object"},"text":{"maxLength":4096,"minLength":1,"type":"string"},"textMaybeEmpty":{"maxLength":4096,"type":"string"},"u32":{"maximum":4294967295,"minimum":0,"type":"integer"},"u64":{"maximum":18446744073709551615,"minimum":0,"type":"integer"}},"$id":"kilix.content.toolchain-profile/v1","$schema":"https://json-schema.org/draft/2020-12/schema","additionalProperties":false,"properties":{"abi":{"additionalProperties":false,"properties":{"endianness":{"enum":["big","little"]},"kernel_abi":{"$ref":"#/$defs/text"},"libc":{"const":"glibc"},"libc_version":{"$ref":"#/$defs/text"},"machine":{"enum":["amd64","arm64","riscv64"]},"pointer_bits":{"const":64}},"required":["libc","libc_version","kernel_abi","machine","endianness","pointer_bits"],"type":"object"},"architecture":{"enum":["amd64","arm64","riscv64"]},"entrypoints":{"items":{"additionalProperties":false,"properties":{"argv":{"items":{"$ref":"#/$defs/textMaybeEmpty"},"maxItems":64,"type":"array","uniqueItems":true},"executable":{"$ref":"#/$defs/absolutePath"},"id":{"$ref":"#/$defs/id"}},"required":["id","executable","argv"],"type":"object"},"maxItems":128,"minItems":1,"type":"array","uniqueItems":true},"environment":{"items":{"additionalProperties":false,"properties":{"name":{"pattern":"^[A-Z_][A-Z0-9_]{0,63}$","type":"string"},"value":{"$ref":"#/$defs/textMaybeEmpty"}},"required":["name","value"],"type":"object"},"maxItems":7,"type":"array","uniqueItems":true},"executables":{"items":{"additionalProperties":false,"properties":{"mode":{"$ref":"#/$defs/s64"},"path":{"$ref":"#/$defs/absolutePath"},"sha256":{"$ref":"#/$defs/digest"}},"required":["path","mode","sha256"],"type":"object"},"maxItems":2048,"type":"array","uniqueItems":true},"id":{"$ref":"#/$defs/id"},"libraries":{"items":{"additionalProperties":false,"properties":{"mode":{"$ref":"#/$defs/s64"},"path":{"$ref":"#/$defs/absolutePath"},"sha256":{"$ref":"#/$defs/digest"}},"required":["path","mode","sha256"],"type":"object"},"maxItems":2048,"type":"array","uniqueItems":true},"offline_python":{"additionalProperties":false,"properties":{"enabled":{"type":"boolean"},"lock_sha256":{"$ref":"#/$defs/digest"},"project_sha256":{"$ref":"#/$defs/digest"},"python_sha256":{"$ref":"#/$defs/digest"},"python_version":{"$ref":"#/$defs/text"},"uv_sha256":{"$ref":"#/$defs/digest"},"uv_version":{"$ref":"#/$defs/text"},"wheels":{"items":{"additionalProperties":false,"properties":{"name":{"$ref":"#/$defs/id"},"sha256":{"$ref":"#/$defs/digest"},"version":{"$ref":"#/$defs/text"}},"required":["name","version","sha256"],"type":"object"},"maxItems":1024,"type":"array","uniqueItems":true}},"required":["enabled","python_version","python_sha256","uv_version","uv_sha256","project_sha256","lock_sha256","wheels"],"type":"object"},"packages":{"items":{"additionalProperties":false,"properties":{"architecture":{"enum":["amd64","arm64","riscv64"]},"name":{"pattern":"^[a-z0-9][a-z0-9+.-]{0,127}$","type":"string"},"sha256":{"$ref":"#/$defs/digest"},"version":{"pattern":"^[A-Za-z0-9][A-Za-z0-9.+:~_-]{0,255}$","type":"string"}},"required":["name","version","architecture","sha256"],"type":"object"},"maxItems":1024,"type":"array","uniqueItems":true},"profile_sha256":{"$ref":"#/$defs/digest"},"release_snapshot":{"additionalProperties":false,"properties":{"distribution":{"const":"debian"},"release_sha256":{"$ref":"#/$defs/digest"},"suite":{"const":"trixie"},"timestamp":{"pattern":"^[0-9]{8}T[0-9]{6}Z$","type":"string"}},"required":["distribution","suite","timestamp","release_sha256"],"type":"object"},"schema":{"const":"kilix.content.toolchain-profile/v1"}},"required":["schema","id","release_snapshot","architecture","packages","executables","libraries","entrypoints","offline_python","environment","abi","profile_sha256"],"title":"Kilix toolchain profile v1","type":"object"}