{"abi":{"endianness":"little","kernel_abi":"6.12","libc":"glibc","libc_version":"2.41","machine":"amd64","pointer_bits":64},"architecture":"amd64","entrypoints":[{"argv":["-I"],"executable":"/usr/bin/python3","id":"python"}],"environment":[{"name":"LANG","value":"C.UTF-8"},{"name":"LC_ALL","value":"C.UTF-8"},{"name":"PATH","value":"/usr/bin"},{"name":"PYTHONDONTWRITEBYTECODE","value":"1"},{"name":"PYTHONHASHSEED","value":"0"},{"name":"SOURCE_DATE_EPOCH","value":"1776729600"},{"name":"TZ","value":"UTC"}],"executables":[{"mode":493,"path":"/usr/bin/python3","sha256":"5941efee0083bffe26de7bbb5378e1ad07258cfb3a3a1d46e63f353fd151b7f1"}],"id":"toolchain.test","libraries":[{"mode":420,"path":"/usr/lib/libc.so","sha256":"265e64d342b514c26e04fecdfe0c1a6a61b91984c62aeb2510add563075d037a"}],"offline_python":{"enabled":true,"lock_sha256":"520f20237c176b597e7ca5d52524ce858922dc81f89bcfdc6df2cb078fcac92b","project_sha256":"244210e48437b6556980a70249a99369934a352429034cef9d7bd253b3bf2c01","python_sha256":"5941efee0083bffe26de7bbb5378e1ad07258cfb3a3a1d46e63f353fd151b7f1","python_version":"3.12.8","uv_sha256":"abe04c7e4501da0dc81a2d571b93ae1d6bc337874ce440eef91a76aac4991451","uv_version":"0.12.3","wheels":[{"name":"demo-wheel","sha256":"63372608fb6e9a771a7c4f450258621e067621ae9254f48f5fe60b8a1cfe87b1","version":"1.0.0"}]},"packages":[{"architecture":"amd64","name":"python3","sha256":"a055ef14212f44d58e1fb30fcb813473a398342e490cf604b98e53a3331c6846","version":"3.12.8-1"}],"profile_sha256":"ad74a10e92d2bb1e13268a5c1bbc4dbcad61b7bd2c5ada5222c1cae92623df66","release_snapshot":{"distribution":"debian","release_sha256":"5f23315f79220a0ca8d7872c22d388ac360230dccfc3090fd461b7f0c8bf1049","suite":"trixie","timestamp":"20260821T000000Z"},"schema":"kilix.content.toolchain-profile/v1"}